{"$schema":"schemas/work-result.schema.json","archive":{"files":[{"contains_row_level_data":false,"contains_sensitive_data":false,"path":"BASELINE_REPORT.md","role":"narrative","sha256":"33d853bb2d79b3667ee01e03ded39c0b0ae0045078cae5f657d3f45fb22b195b"},{"contains_row_level_data":false,"contains_sensitive_data":false,"path":"CHECKSUMS.sha256","role":"checksum","sha256":"50419c765815c6ec804516c7a5f564bc559c1f402ade41f2d4199f8022e68f94"},{"contains_row_level_data":false,"contains_sensitive_data":false,"path":"commands.log","role":"command_log","sha256":"5bfb2472e268b80da6cc473b12646b68542bd4daabc9a6ae8bc6374e818d1de3"},{"contains_row_level_data":false,"contains_sensitive_data":false,"path":"environment.txt","role":"environment","sha256":"eca558eb7806b9907084534b168160ff5ea429aa593b6b8a0d2b284ae475aca6"},{"contains_row_level_data":false,"contains_sensitive_data":false,"path":"model_artifacts.json","role":"configuration","sha256":"563a8c114a8e55e2767fef47650b50d2605c25b7f04c49f18c336d3f0551513a"},{"contains_row_level_data":false,"contains_sensitive_data":false,"path":"tables/development_metrics.csv","role":"aggregate_table","sha256":"4afa8aa6e28d548811cbf894393a000871befde839258172d7fcd681588248fc"},{"contains_row_level_data":false,"contains_sensitive_data":false,"path":"tables/development_summary.csv","role":"aggregate_table","sha256":"e8d81ea7935618b37847bddc81ad31981d8eee2974d82f61898ddda49f375c9a"},{"contains_row_level_data":false,"contains_sensitive_data":false,"path":"tables/model_costs.csv","role":"aggregate_table","sha256":"c3f1464679f582f4d9c9fd0f778a472cafeb210a4334d00ccf26c6ab06088d46"},{"contains_row_level_data":false,"contains_sensitive_data":false,"path":"tables/pipeline_diagnostics.csv","role":"aggregate_table","sha256":"9569a3e21ad496f19bd6a625010131ac3a0b19138d360a5ddc9a4d2c744dd67b"}]},"completed_at":"2026-07-28T12:22:44Z","decision":{"action":"complete","notes":"Close T005 without tuning or starting another task."},"design_commit":null,"design_sha256":null,"evidence":[{"claim":"T005 development baseline result","limitations":"B1-B4 only; dish washer is development-only","path":"BASELINE_REPORT.md","scope":"formal_development"},{"claim":"Full fold-seed-house-appliance aggregate metrics","limitations":"No row-level predictions or locked-test data","path":"tables/development_metrics.csv","scope":"formal_development"}],"execution":{"notes":"one canonical matrix and one F1 seed-0 sentinel rerun","status":"succeeded"},"experiment_kind":"not_applicable","lifecycle_status":"completed","limitations":["No B5 or Protocol X model evaluation.","Dish washer evidence is development-only.","Python-reference latency is not host-native or Pico performance."],"metrics":[{"aggregation":"appliance-unweighted macro of each seed's unweighted F1-F4 mean; mean across five seeds","definition":"macro F1 for fridge and microwave","measurement_boundary":"end-to-end candidate plus no-output target misses","name":"macro_seed_fold_mean_f1","scope":"full_eligible_macro_2class","unit":"ratio","value":0.34581830382432893},{"aggregation":"appliance-unweighted macro of each seed's unweighted F1-F4 mean; mean across five seeds","definition":"macro F1 including development-only dish washer","measurement_boundary":"end-to-end candidate plus no-output target misses","name":"macro_seed_fold_mean_f1","scope":"development_scope_macro_3class","unit":"ratio","value":0.30167595417662935}],"name":"Protocol R Baseline Implementation","observations":["No method or parameter was selected using the result.","F1 seed-0 sentinel reproduced candidate, encoder, model, prediction and metric hashes."],"outcome":"completed","output_policy":"compact aggregate evidence and hashes only","owner":"Tianhang Tan","protocol":{"claim_scope":"formal development","data_scope":"H1/H3/H5/H6 B1-B4 four-fold development CV","name":"Protocol R v1","sealed_test_access":false},"provenance":{"base_git_commit":"4fb5129ee1afcdc50fee2033eedf7b2f2f03aa9f","config_files":[{"path":"artifacts/manifests/protocol_r_baseline_v1.json","sha256":"16122453085d9a0fa65274ea568ddc2baccafd3b8a227a87e1d1f113dccc7754"}],"data_manifests":[],"environment":{"path":"experiments/T005-protocol-r-baseline-implementation/environment.txt","sha256":"eca558eb7806b9907084534b168160ff5ea429aa593b6b8a0d2b284ae475aca6"},"executed_source_files":[{"path":"tools/data/protocol_r_access.py","sha256":"b4700646666ac812334e806ac10a38ba0b6f7017f48a15e122666541aec043ca"},{"path":"tools/baseline/__init__.py","sha256":"c33d0dedb03d33e8b2721dc196a92f52f25ebd32ecf9af4de088ef80fc52e076"},{"path":"tools/baseline/encoding.py","sha256":"6bce0cbd2aa8299e50ddc9fc225d118f11a62f6cbb5de852ffcef4055d6f11e3"},{"path":"tools/baseline/model.py","sha256":"feab7d7a76c99acf5f6dccb8808c30345d6acb57f796a4c45ff7cfc261c7727c"},{"path":"tools/baseline/pipeline.py","sha256":"0f84ff9e4a6c56c7f62552fa80074255d9697bf77e7ce1900a8c1c2c624d905a"},{"path":"tools/baseline/metrics.py","sha256":"dab1115ed3576090d3a9acf67077435af9857bb05c34bc69a29199817c4e66b2"},{"path":"tools/baseline/run_protocol_r_baseline.py","sha256":"8a5245675298f649ef904d2a8a6eb2c117df52f1743d3b3b009863776b685921"},{"path":"tests/baseline/test_t005_access.py","sha256":"691571f13959bd3be590545ac76605ceb762f48e9caa6405efb099d63a09659b"},{"path":"tests/baseline/test_t005_model.py","sha256":"7db3d36a52358a376b3900f81650f2ba9f3b1988c6728c617e777a852898b4c3"},{"path":"tests/baseline/test_t005_pipeline.py","sha256":"69dcc2ab9ecc886f892f177df20112b78c31777ac42e555791acc6f0f6f7bf6b"}],"reused_learned_artifacts":[],"worktree_dirty_at_execution":false},"reproducibility":{"folds":["F1","F2","F3","F4"],"repeat_count":2,"seeds":[0,1,2,3,4]},"result_summary":"Fixed Protocol R B1-B4 development baseline completed with two named macro scopes and exact F1/seed-0 sentinel reproducibility.","safety_assertions":{"no_candidate_or_locked_test_derived_learned_state":true,"no_candidate_or_locked_test_feedback":true,"preprocessing_fit_scope":"train_only","shared_inputs_are_immutable_and_hashed":true},"schema_version":"1.0","status":"complete","superseded_by":null,"task_definition":"docs/tasks/T005-protocol-r-baseline-implementation.md","track":"T-series","validity":{"notes":"fixed method, protected access guard, exact sentinel hashes","status":"valid"},"work_id":"T005","work_kind":"formal_implementation","workflow_layer":"aggregate-main classification-TM development baseline"}
